[
  {
    "id": "item_rusty_sword",
    "name": "녹슨 검",
    "description": "오랜 세월 방치되어 녹이 슨 낡은 검. 그래도 초보 모험가에겐 충분한 무기다.",
    "rarity": "common",
    "type": "weapon",
    "level_requirement": 1,
    "stats": { "atk": 8, "def": 0, "hp": 0, "mp": 0 },
    "special_effect": null,
    "lore": "아르카니아 왕국의 민병대에서 사용하던 표준 지급품. 전쟁이 끝난 후 대부분 버려졌으나, 신참 모험가들이 주워 쓰고 있다.",
    "obtained_from": "시작 마을 상점"
  },
  {
    "id": "item_leather_vest",
    "name": "가죽 조끼",
    "description": "질긴 가죽으로 만든 기본 방어구. 가볍고 움직이기 편하다.",
    "rarity": "common",
    "type": "armor",
    "level_requirement": 1,
    "stats": { "atk": 0, "def": 6, "hp": 15, "mp": 0 },
    "special_effect": null,
    "lore": "푸른 초원 지대의 사냥꾼들이 즐겨 입는 방어구. 거친 들짐승의 발톱 정도는 막아낼 수 있다.",
    "obtained_from": "시작 마을 상점"
  },
  {
    "id": "item_minor_heal_potion",
    "name": "하급 치유의 물약",
    "description": "붉은빛이 감도는 작은 물약. 마시면 상처가 천천히 아문다.",
    "rarity": "common",
    "type": "consumable",
    "level_requirement": 1,
    "stats": { "atk": 0, "def": 0, "hp": 50, "mp": 0 },
    "special_effect": "즉시 HP 50 회복",
    "lore": "초원 마을의 약초사 엘리나가 조제하는 기본 치유약. 재료가 흔하여 누구나 구할 수 있다.",
    "obtained_from": "초원 마을 약초상"
  },
  {
    "id": "item_wolf_fang_necklace",
    "name": "늑대 송곳니 목걸이",
    "description": "거대 늑대의 송곳니를 깎아 만든 목걸이. 착용자에게 야수의 힘을 부여한다.",
    "rarity": "uncommon",
    "type": "accessory",
    "level_requirement": 5,
    "stats": { "atk": 5, "def": 2, "hp": 20, "mp": 0 },
    "special_effect": "공격 시 3% 확률로 출혈 부여 (5초간 초당 2 피해)",
    "lore": "초원의 사냥꾼들은 첫 번째로 잡은 거대 늑대의 이빨을 목에 거는 전통이 있다. 이것은 용기의 증표이자, 사냥꾼으로서의 첫걸음을 상징한다.",
    "obtained_from": "mob_giant_wolf 처치 시 드롭"
  },
  {
    "id": "item_iron_longsword",
    "name": "무쇠 장검",
    "description": "대장간에서 단조한 튼튼한 장검. 균형이 잘 잡혀 있어 다루기 쉽다.",
    "rarity": "uncommon",
    "type": "weapon",
    "level_requirement": 10,
    "stats": { "atk": 22, "def": 0, "hp": 0, "mp": 0 },
    "special_effect": null,
    "lore": "아르카니아 왕국의 정규군이 사용하는 표준 장검. 왕실 문양이 칼자루에 새겨져 있으며, 그 품질은 왕국의 기술력을 대변한다.",
    "obtained_from": "초원 마을 대장간"
  },
  {
    "id": "item_chainmail",
    "name": "쇠사슬 갑옷",
    "description": "수천 개의 쇠고리를 엮어 만든 갑옷. 베기 공격에 강한 저항력을 보인다.",
    "rarity": "uncommon",
    "type": "armor",
    "level_requirement": 10,
    "stats": { "atk": 0, "def": 18, "hp": 40, "mp": 0 },
    "special_effect": "베기 피해 5% 감소",
    "lore": "고대 드워프의 기술을 전수받은 인간 대장장이들이 제작하는 방어구. 무겁지만 그만큼 든든하다.",
    "obtained_from": "숲 지역 대장간"
  },
  {
    "id": "item_mana_crystal_ring",
    "name": "마나 수정 반지",
    "description": "작은 마나 수정이 박힌 은반지. 착용자의 마력을 증폭시킨다.",
    "rarity": "uncommon",
    "type": "accessory",
    "level_requirement": 12,
    "stats": { "atk": 3, "def": 0, "hp": 0, "mp": 35 },
    "special_effect": "MP 자연 회복량 10% 증가",
    "lore": "엘프 마법사들이 수련 시절 사용하는 보조 도구. 인간 마법사들 사이에서도 수요가 높아 꽤 비싼 값에 거래된다.",
    "obtained_from": "속삭이는 숲 보물 상자"
  },
  {
    "id": "item_forest_guardian_bow",
    "name": "숲 수호자의 활",
    "description": "고대 나무의 가지로 만든 장궁. 숲의 정령의 가호가 깃들어 있다.",
    "rarity": "rare",
    "type": "weapon",
    "level_requirement": 20,
    "stats": { "atk": 45, "def": 0, "hp": 0, "mp": 15 },
    "special_effect": "숲 지역에서 공격력 8% 증가",
    "lore": "속삭이는 숲의 최심부에서 자라는 세계수의 가지를 깎아 만든 활. 정령들의 축복이 깃들어 있어, 화살에 자연의 힘이 실린다. 숲의 수호자로 인정받은 자만이 다룰 수 있다.",
    "obtained_from": "mob_forest_golem 처치 시 드롭"
  },
  {
    "id": "item_mid_heal_potion",
    "name": "중급 치유의 물약",
    "description": "진한 붉은빛의 물약. 하급 물약보다 훨씬 강력한 치유 효과를 지닌다.",
    "rarity": "uncommon",
    "type": "consumable",
    "level_requirement": 15,
    "stats": { "atk": 0, "def": 0, "hp": 200, "mp": 0 },
    "special_effect": "즉시 HP 200 회복",
    "lore": "숲 깊은 곳에서만 자라는 희귀 약초를 주재료로 사용한다. 조제에 상당한 기술이 필요하여 일반 약초사로는 만들기 어렵다.",
    "obtained_from": "숲 마을 약초상"
  },
  {
    "id": "item_flame_blade",
    "name": "화염의 칼날",
    "description": "칼날에 영원히 꺼지지 않는 불꽃이 감싸고 있는 마검.",
    "rarity": "rare",
    "type": "weapon",
    "level_requirement": 30,
    "stats": { "atk": 72, "def": 0, "hp": 0, "mp": 10 },
    "special_effect": "공격 시 15% 확률로 화상 부여 (3초간 초당 15 피해)",
    "lore": "화산 지대 깊숙한 곳의 용암 속에서 단조된 마검. 고대 화염 정령의 핵을 녹여 칼날에 주입하였다. 검을 쥔 자는 칼날에서 끊임없이 뿜어져 나오는 열기를 느낀다.",
    "obtained_from": "mob_flame_guardian 처치 시 드롭"
  },
  {
    "id": "item_volcanic_plate",
    "name": "화산암 판금갑",
    "description": "화산 지대의 특수한 광석으로 제련한 판금 갑옷. 열기에 강한 저항력을 지닌다.",
    "rarity": "rare",
    "type": "armor",
    "level_requirement": 30,
    "stats": { "atk": 0, "def": 48, "hp": 120, "mp": 0 },
    "special_effect": "화염 피해 15% 감소",
    "lore": "불의 산맥에서 채굴되는 화산석은 일반 용광로로는 녹일 수 없다. 오직 드워프 명장들만이 화산의 지열을 이용하여 이 광석을 가공할 수 있다.",
    "obtained_from": "불의 산맥 대장간 제작"
  },
  {
    "id": "item_elixir_of_fury",
    "name": "분노의 영약",
    "description": "붉은 증기가 피어오르는 격렬한 영약. 마시면 전투력이 일시적으로 폭증한다.",
    "rarity": "rare",
    "type": "consumable",
    "level_requirement": 25,
    "stats": { "atk": 30, "def": 0, "hp": 0, "mp": 0 },
    "special_effect": "30초간 공격력 25% 증가, 방어력 10% 감소",
    "lore": "광전사들이 전투 전에 복용하는 비약. 이성을 일부 잃는 대신, 육체의 한계를 넘어서는 힘을 발휘할 수 있다. 남용하면 정신이 영구히 손상될 수 있다.",
    "obtained_from": "화산 지대 연금술사"
  },
  {
    "id": "item_frost_pendant",
    "name": "서리꽃 목걸이",
    "description": "영원히 녹지 않는 얼음 결정으로 만든 목걸이. 차가운 기운이 끊임없이 흘러나온다.",
    "rarity": "rare",
    "type": "accessory",
    "level_requirement": 35,
    "stats": { "atk": 10, "def": 15, "hp": 50, "mp": 40 },
    "special_effect": "얼음 피해 12% 감소, 동결 저항 30% 증가",
    "lore": "얼음 동굴의 심연에서 수천 년에 걸쳐 형성된 영구 빙정. 이것을 다듬어 목걸이로 만들면, 착용자를 극한의 냉기로부터 보호하는 부적이 된다.",
    "obtained_from": "얼음 동굴 보물 상자"
  },
  {
    "id": "item_glacial_warhammer",
    "name": "빙하의 전투망치",
    "description": "만년빙으로 이루어진 거대한 전투망치. 내려치면 주변이 얼어붙는다.",
    "rarity": "epic",
    "type": "weapon",
    "level_requirement": 45,
    "stats": { "atk": 110, "def": 10, "hp": 0, "mp": 20 },
    "special_effect": "공격 시 20% 확률로 적을 2초간 동결, 동결된 적에게 추가 피해 30%",
    "lore": "얼음 동굴의 최심부를 지배하는 서리 거인의 무기였다. 거인이 쓰러진 후에도 망치에 깃든 냉기는 사라지지 않았으며, 이를 들어올릴 수 있는 자는 극소수에 불과하다.",
    "obtained_from": "mob_frost_giant 처치 시 드롭"
  },
  {
    "id": "item_shadow_cloak",
    "name": "그림자 망토",
    "description": "어둠 그 자체를 직조하여 만든 망토. 착용자의 존재감을 희미하게 만든다.",
    "rarity": "epic",
    "type": "armor",
    "level_requirement": 50,
    "stats": { "atk": 15, "def": 65, "hp": 100, "mp": 50 },
    "special_effect": "전투 시작 시 3초간 은신 상태, 회피율 12% 증가",
    "lore": "어둠의 성에서 활동하는 암흑 직조사들이 만드는 저주받은 망토. 그림자 차원의 실을 사용하여 짜여졌으며, 착용자를 현실과 그림자 사이의 경계에 존재하게 만든다.",
    "obtained_from": "어둠의 성 보물 상자"
  },
  {
    "id": "item_dark_soul_gem",
    "name": "어둠의 혼석",
    "description": "칠흑의 빛을 내뿜는 보석. 강력한 암흑 마력이 응축되어 있다.",
    "rarity": "epic",
    "type": "accessory",
    "level_requirement": 50,
    "stats": { "atk": 25, "def": 10, "hp": 60, "mp": 80 },
    "special_effect": "암흑 속성 스킬 피해 18% 증가, 받는 성스러운 피해 10% 증가",
    "lore": "어둠의 군주 벨카자르의 성에서 발견되는 희귀한 마석. 수백 년간 암흑 마력에 노출된 광석이 변질되어 생성되며, 그 안에는 어둠에 삼켜진 영혼들의 한탄이 메아리친다.",
    "obtained_from": "mob_shadow_knight 처치 시 드롭"
  },
  {
    "id": "item_supreme_heal_potion",
    "name": "최상급 치유의 물약",
    "description": "황금빛으로 빛나는 최고급 치유약. 치명상도 순식간에 회복시킨다.",
    "rarity": "rare",
    "type": "consumable",
    "level_requirement": 40,
    "stats": { "atk": 0, "def": 0, "hp": 800, "mp": 200 },
    "special_effect": "즉시 HP 800, MP 200 회복",
    "lore": "전설적인 연금술사 아르투스의 비법으로만 조제할 수 있는 최고급 물약. 세계수의 수액과 불사조의 눈물이 주재료이며, 한 병을 만드는 데 일주일이 걸린다.",
    "obtained_from": "어둠의 성 입구 약초상"
  },
  {
    "id": "item_sword_of_dawn",
    "name": "여명의 성검",
    "description": "성스러운 빛을 내뿜는 전설의 검. 어둠을 물리치기 위해 단조되었다.",
    "rarity": "legendary",
    "type": "weapon",
    "level_requirement": 60,
    "stats": { "atk": 180, "def": 20, "hp": 50, "mp": 30 },
    "special_effect": "성스러운 속성 부여: 언데드 및 암흑 속성 적에게 추가 피해 25%, 파티원 전체 공격력 5% 증가",
    "lore": "태초의 빛의 신 아엘리온이 첫 번째 용사에게 내린 성검. 천 년의 세월 동안 봉인되어 있었으나, 어둠의 군주가 다시 깨어남에 따라 새로운 주인을 기다리고 있다. 검에서 뿜어져 나오는 여명의 빛은 절망 속에서도 희망을 잃지 않는 자에게만 응답한다.",
    "obtained_from": "메인 퀘스트 '여명의 시련' 완료 보상"
  },
  {
    "id": "item_crown_of_eternity",
    "name": "영원의 왕관",
    "description": "시간의 흐름조차 거부하는 고대 왕관. 착용자에게 불멸에 가까운 생명력을 부여한다.",
    "rarity": "legendary",
    "type": "accessory",
    "level_requirement": 65,
    "stats": { "atk": 30, "def": 40, "hp": 300, "mp": 150 },
    "special_effect": "HP가 20% 이하일 때 자동으로 HP 50% 회복 (쿨타임 180초), 모든 상태이상 지속시간 30% 감소",
    "lore": "아르카니아 대륙을 최초로 통일한 영원왕 칼리오스의 왕관. 그가 신들과 맺은 계약의 증표로, 착용자의 영혼을 시간의 바깥에 묶어 놓는다. 왕관에 박힌 일곱 개의 보석은 각각 일곱 신의 축복을 상징한다.",
    "obtained_from": "mob_dark_lord_velkazar 처치 시 드롭"
  },
  {
    "id": "item_abyssal_aegis",
    "name": "심연의 방패",
    "description": "어둠과 빛의 경계에서 태어난 전설의 방패. 모든 공격을 흡수하는 심연의 힘이 깃들어 있다.",
    "rarity": "legendary",
    "type": "armor",
    "level_requirement": 70,
    "stats": { "atk": 20, "def": 120, "hp": 500, "mp": 100 },
    "special_effect": "받는 모든 피해 8% 감소, 피해를 받을 때 10% 확률로 피해를 완전 무효화, 파티원 전체 방어력 5% 증가",
    "lore": "어둠의 군주 벨카자르를 봉인했던 고대 수호자의 방패. 심연의 물질로 이루어져 있어 물리적 형태가 일정하지 않으며, 주인의 의지에 따라 형태를 바꾼다. 이것을 들 자격이 있는 자는, 빛과 어둠 양쪽 모두를 이해하는 자뿐이다.",
    "obtained_from": "메인 퀘스트 '심연의 각성' 완료 보상"
  }
]
